{
  "schema_version": "0.1.0",
  "proposal_id": "PRP-CLM-010755",
  "object_type": "claim",
  "run_id": "RUN-OFS005-PILOT-005",
  "origin_group_ids": [
    "ORG-42A25068140E",
    "ORG-7F16D9AE700E"
  ],
  "has_primary_source": true,
  "artifact_id": "CLM-010755",
  "created_by_agent_id": "synthesis-public-01",
  "created_at": "2026-08-23T20:13:22.066697Z",
  "evidence_bundle_refs": [
    "proposals/evidence/RUN-OFS005-PILOT-005/WORK-000017.json",
    "proposals/evidence/RUN-OFS005-PILOT-005/WORK-000018.json"
  ],
  "claim_candidate": {
    "schema_version": "0.1.0",
    "claim_id": "CLM-010755",
    "statement": "Commercial emerging-compute and memory programs can undergo ownership consolidation or future-development termination even after reaching the market.",
    "claim_kind": "reported_claim",
    "temporal_scope": "Commercial program changes announced in 2022-2024",
    "conditions": [
      "Scope is limited to the cited public sources and stated dates."
    ],
    "evidence_ids": [
      "EVD-3E7254A105BE",
      "EVD-C82277610D2F"
    ],
    "source_lineage_ids": [
      "LIN-1035797F86CF",
      "LIN-8C0BA0E269D8"
    ],
    "status": "candidate"
  },
  "work_item_id": "WORK-000025"
}
