{
  "schema_version": "0.2.0",
  "proposal_id": "PRP-CLM-031380",
  "object_type": "claim",
  "run_id": "RUN-OFS005-PILOT-009",
  "origin_group_ids": [
    "ORG-2E2FED58009F",
    "ORG-DC5955727F85"
  ],
  "has_primary_source": true,
  "artifact_id": "CLM-031380",
  "created_by_agent_id": "synthesis-public-01",
  "created_at": "2026-08-23T20:33:59.319168Z",
  "evidence_bundle_refs": [
    "proposals/evidence/RUN-OFS005-PILOT-009/WORK-000025.json",
    "proposals/evidence/RUN-OFS005-PILOT-009/WORK-000026.json"
  ],
  "claim_candidate": {
    "schema_version": "0.1.0",
    "claim_id": "CLM-031380",
    "statement": "日本の大学・共同利用計算基盤では、異種アクセラレータ、高速ネットワーク、大容量並列ストレージ、ソフトウェア環境を統合したシステムが運用されている。",
    "claim_kind": "observed_fact",
    "temporal_scope": "2025年時点で運用される日本の大学・共同利用計算基盤",
    "conditions": [
      "Scope is limited to the cited public sources and stated dates."
    ],
    "evidence_ids": [
      "EVD-431199DF133D",
      "EVD-864E40645428"
    ],
    "source_lineage_ids": [
      "LIN-C1B2EF2A57A2",
      "LIN-F80E3D6CD749"
    ],
    "status": "candidate"
  },
  "publisher_group_ids": [
    "PUB-367859B90EA0",
    "PUB-89DA347178E8"
  ],
  "work_item_id": "WORK-000037"
}
