{
  "schema_version": "0.1.0",
  "proposal_id": "PRP-CLM-555522",
  "object_type": "claim",
  "run_id": "RUN-OFS005-PILOT-006",
  "origin_group_ids": [
    "ORG-E5772BA6CE2F",
    "ORG-F38DDEC02026"
  ],
  "has_primary_source": true,
  "artifact_id": "CLM-555522",
  "created_by_agent_id": "synthesis-public-01",
  "created_at": "2026-08-23T20:18:07.747855Z",
  "evidence_bundle_refs": [
    "proposals/evidence/RUN-OFS005-PILOT-006/WORK-000029.json",
    "proposals/evidence/RUN-OFS005-PILOT-006/WORK-000030.json"
  ],
  "claim_candidate": {
    "schema_version": "0.1.0",
    "claim_id": "CLM-555522",
    "statement": "Peer-reviewed studies of Fugaku and Frontier evaluate supercomputer architecture together with software and application behavior rather than relying on peak performance alone.",
    "claim_kind": "reported_claim",
    "temporal_scope": "Peer-reviewed system studies published in 2022-2023",
    "conditions": [
      "Scope is limited to the cited public sources and stated dates."
    ],
    "evidence_ids": [
      "EVD-DF9E76917207",
      "EVD-E2EDB403A7E7"
    ],
    "source_lineage_ids": [
      "LIN-861C2F34EC4A",
      "LIN-8CDEF4281F42"
    ],
    "status": "candidate"
  },
  "work_item_id": "WORK-000034"
}
