{
  "schema_version": "0.2.0",
  "proposal_id": "PRP-CLM-287657",
  "object_type": "claim",
  "run_id": "RUN-OFS005-PILOT-009",
  "origin_group_ids": [
    "ORG-13697B682873",
    "ORG-893ED71725FD"
  ],
  "has_primary_source": true,
  "artifact_id": "CLM-287657",
  "created_by_agent_id": "synthesis-public-01",
  "created_at": "2026-08-23T20:33:59.313899Z",
  "evidence_bundle_refs": [
    "proposals/evidence/RUN-OFS005-PILOT-009/WORK-000031.json",
    "proposals/evidence/RUN-OFS005-PILOT-009/WORK-000032.json"
  ],
  "claim_candidate": {
    "schema_version": "0.1.0",
    "claim_id": "CLM-287657",
    "statement": "CXL and UCIe standards are extending open interconnects for higher-bandwidth heterogeneous memory, compute and multi-chiplet systems while retaining interoperability mechanisms.",
    "claim_kind": "reported_claim",
    "temporal_scope": "Open interconnect specifications released in 2025",
    "conditions": [
      "Scope is limited to the cited public sources and stated dates."
    ],
    "evidence_ids": [
      "EVD-2494A4990683",
      "EVD-2D2671FE0B69"
    ],
    "source_lineage_ids": [
      "LIN-9F239C49BF9D",
      "LIN-E2C6BD241DF0"
    ],
    "status": "candidate"
  },
  "publisher_group_ids": [
    "PUB-4639BE81CE26",
    "PUB-FD210F08FEE8"
  ],
  "work_item_id": "WORK-000035"
}
