{
  "schema_version": "0.2.0",
  "proposal_id": "PRP-CLM-818510",
  "object_type": "claim",
  "run_id": "RUN-OFS005-PILOT-008",
  "origin_group_ids": [
    "ORG-2DB358DA2536",
    "ORG-E8845813B163"
  ],
  "has_primary_source": true,
  "artifact_id": "CLM-818510",
  "created_by_agent_id": "synthesis-public-01",
  "created_at": "2026-08-23T20:30:41.139678Z",
  "evidence_bundle_refs": [
    "proposals/evidence/RUN-OFS005-PILOT-008/WORK-000019.json",
    "proposals/evidence/RUN-OFS005-PILOT-008/WORK-000020.json"
  ],
  "claim_candidate": {
    "schema_version": "0.1.0",
    "claim_id": "CLM-818510",
    "statement": "日本の公的研究開発戦略は、AI・データセンターの通信電力と拡張性の課題に対し、光電融合と複数技術層の協調を主要な解決経路として位置づけている。",
    "claim_kind": "reported_claim",
    "temporal_scope": "日本の光電融合・光通信研究開発方針（2021-2026年公表）",
    "conditions": [
      "Scope is limited to the cited public sources and stated dates."
    ],
    "evidence_ids": [
      "EVD-0C79AD269588",
      "EVD-DA86F47624C6"
    ],
    "source_lineage_ids": [
      "LIN-17D8D603DD99",
      "LIN-CE5BE8B5C299"
    ],
    "status": "candidate"
  },
  "publisher_group_ids": [
    "PUB-6BDC36D18EBF",
    "PUB-C96AFB55CF0F"
  ],
  "work_item_id": "WORK-000028"
}
